{
  "$schema": "http://json-schema.org/draft-07/schema#",
  "$id": "https://gmi-youtube.github.io/schemas/guide-config.json",
  "title": "Guide Config",
  "description": "Configuration for the station TV guide, defining editorial blocks and scheduling behaviour",
  "type": "object",
  "required": ["blocks", "updatedAt"],
  "properties": {
    "blocks": {
      "type": "array",
      "minItems": 1,
      "items": {
        "type": "object",
        "required": ["name", "startHour", "endHour", "character"],
        "properties": {
          "name": {
            "type": "string",
            "description": "Block identifier (e.g. 'morning', 'evening')"
          },
          "startHour": {
            "type": "integer",
            "minimum": 0,
            "maximum": 30,
            "description": "Start hour in 24h format (values above 24 represent next-day hours, e.g. 26 = 02:00)"
          },
          "endHour": {
            "type": "integer",
            "minimum": 0,
            "maximum": 30,
            "description": "End hour in 24h format (values above 24 represent next-day hours)"
          },
          "character": {
            "type": "string",
            "description": "Editorial character of the block (e.g. 'Short-form, news, briefings')"
          },
          "maxDurationMinutes": {
            "type": "integer",
            "minimum": 1,
            "description": "Preferred maximum video duration in minutes for this block"
          },
          "preferredTags": {
            "type": "array",
            "items": { "type": "string" },
            "description": "Tags that are preferred for this block"
          }
        },
        "additionalProperties": false
      },
      "description": "Ordered list of editorial blocks that define the daily schedule"
    },
    "bufferMinutes": {
      "type": "integer",
      "minimum": 0,
      "description": "Buffer time in minutes between scheduled entries (default: 15)"
    },
    "defaultDurationMinutes": {
      "type": "integer",
      "minimum": 1,
      "description": "Default assumed duration in minutes when a video has no duration metadata (default: 30)"
    },
    "updatedAt": {
      "type": "string",
      "format": "date-time",
      "description": "ISO 8601 timestamp of the last configuration update"
    }
  },
  "additionalProperties": false
}
